{
  "schema": "loc-delivery-manifest.v1",
  "delivery_id": "delivery-honest-coherence-stabilization",
  "intent": {
    "type": "user_story",
    "story_id": "STORY-HONEST-COHERENCE-001",
    "actor": "studio_operator",
    "need": "know whether coherence scores are earned rather than copied",
    "value": "prevent false governance narratives from passing release",
    "source": "docs/claude-thread-2.txt"
  },
  "acceptance": {
    "source": "docs/LOC-NORTH-STAR-IMPLEMENTATION-PACKET.md",
    "scenarios": [
      {
        "id": "SCN-HC-001",
        "name": "copied method responsibility lowers coherence",
        "test_command": "npm run test:evidence",
        "expected_result": "pass"
      },
      {
        "id": "SCN-HC-002",
        "name": "distinct method responsibility raises coherence",
        "test_command": "npm run test:taxonomy-case",
        "expected_result": "pass"
      }
    ]
  },
  "implementation": {
    "changed_files": [
      {
        "path": "src/story-analysis/coherence-evaluator.js",
        "reason": "replace similarity scoring with responsibility integrity scoring",
        "value_link": "STORY-HONEST-COHERENCE-001",
        "acceptance_links": ["SCN-HC-001", "SCN-HC-002"]
      },
      {
        "path": "src/observability/taxonomy-scan-report.js",
        "reason": "separate missing taxonomy from false taxonomy in the scan report",
        "value_link": "STORY-HONEST-COHERENCE-001",
        "acceptance_links": ["SCN-HC-002"]
      }
    ]
  },
  "coherence_sources": {
    "taxonomy_scan": "reports/scan-report-latest.json",
    "story_review": "reports/codebase-story-review-latest.json",
    "readme_projection": "README.md"
  },
  "release_gates": {
    "acceptance": "required",
    "local_taxonomy": "required",
    "filesystem_story": "required",
    "readme_alignment": "required",
    "canonical_residue": "required",
    "file_economy": "required",
    "learning_record": "required",
    "waivers": []
  },
  "learning": {
    "record_path": "reports/delivery-learning/delivery-honest-coherence-stabilization.json",
    "future_regressions": [
      "method responsibility copied from file responsibility must not earn 100"
    ]
  }
}
